
<?xml version="1.0"?>
<!DOCTYPE profile SYSTEM "/usr/share/autoinstall/dtd/profile.dtd">
<profile xmlns="http://www.suse.com/1.0/yast2ns" xmlns:config="http://www.suse.com/1.0/configns">
  <configure>
    <proxy>
      <enabled config:type="boolean">true</enabled>
      <ftp_proxy>http://192.168.1.240:3128</ftp_proxy>
      <http_proxy>http://192.168.1.240:3128</http_proxy>
      <no_proxy>localhost</no_proxy>
      <proxy_password>testpw</proxy_password>
      <proxy_user>testuser</proxy_user>
    </proxy>
  </configure>
</profile>

